{
  "$schema": "https://json-schema.org/draft/2020-12/schema",
  "title": "Command Registry and Typed CLI Surface Baseline v0.1",
  "type": "object",
  "required": [
    "version",
    "runtime_plane_mode",
    "registry_model",
    "framework_retained",
    "commands"
  ],
  "properties": {
    "version": { "type": "string", "const": "v0.1" },
    "runtime_plane_mode": { "type": "string", "const": "command_registry_and_typed_cli_surface_baseline" },
    "registry_model": { "type": "string", "const": "registry_driven_cli_substrate" },
    "framework_retained": { "type": "string", "const": "python_typer" },
    "commands": {
      "type": "array",
      "minItems": 1,
      "items": {
        "type": "object",
        "required": [
          "name",
          "description",
          "aliases",
          "availability",
          "is_enabled",
          "is_hidden",
          "output_modes",
          "truth_boundary",
          "automation_level"
        ],
        "properties": {
          "name": { "type": "string", "minLength": 1 },
          "description": { "type": "string", "minLength": 1 },
          "aliases": { "type": "array", "items": { "type": "string" } },
          "availability": { "type": "string", "enum": ["public", "internal", "topology_limited", "profile_limited"] },
          "is_enabled": { "type": "boolean" },
          "is_hidden": { "type": "boolean" },
          "output_modes": { "type": "array", "items": { "type": "string" }, "minItems": 1 },
          "truth_boundary": { "type": "string", "minLength": 1 },
          "automation_level": { "type": "string", "enum": ["manual_handoff", "partial_runtime", "full_runtime"] }
        },
        "additionalProperties": true
      }
    }
  },
  "additionalProperties": false
}
